objectid,parentid,title,creator,date,description,subject,location,latitude,longitude,source,identifier,type,format,language,rightsstatement,rights,display_template,object_location,image_small,image_thumb
hell-s-half-acre,,Hell's Half Acre,Keeping Watch,,"Hells Half Acre is an R-6 cabin that is easily accessible by road in the Selway-Bitterroot Wilderness. Originally a platform on top of a forty-foot-tall tower, the original Hell’s Half Acre cabin was an L-4.  Now one of the most popular lookouts in Idaho or Montana, it sits above a snag forest of mostly lodgepole pine. A sign at the base of the summit informs drivers that the tower opens at 9 am. Unsure if this refers to mountain or pacific time, we wait at the sign and drink our coffee. ",,,45.64579,-114.62838,Keeping Watch Fire Tower Oral HIstory Project,,record,compound_object,eng,http://rightsstatements.org/vocab/InC-EDU/1.0/,"In Copyright - Educational Use Permitted. For more information, please contact University of Idaho Library Special Collections and Archives Department at libspec@uidaho.edu.",compound_object,,https://cdil.lib.uidaho.edu/keeping-watch/objects/small/hells_half_theta_sm.jpg,https://cdil.lib.uidaho.edu/keeping-watch/objects/thumbs/hells_half_theta_th.jpg
,hell-s-half-acre,Hell's Half Acre Lookout 360 Image,Keeping Watch,2021-07-13,360 Image of the Interior of Hell's Half Acre Fire Tower,,Hell's Half Acre,45.64579,-114.62838,,,image;stllimage,image/jpeg,eng,,,panorama,/objects/hells_half_theta.JPG,https://cdil.lib.uidaho.edu/keeping-watch/objects/small/hells_half_theta_sm.jpg,https://cdil.lib.uidaho.edu/keeping-watch/objects/thumbs/hells_half_theta_th.jpg
,hell-s-half-acre,Patrick McMarron Records Fire Conditions at Hell's Half Acre Lookout,Keeping Watch,2021-07-13,Video of Patrick McMarron recording fire conditions in July of 2021 on Hells Half Acre Fire Lookout,,Hell's Half Acre,45.64579,-114.62838,,,image;MovingImage,video/mp4,eng,,,video,https://cdil.lib.uidaho.edu/keeping-watch/objects/hell-s-half-acre/patrick_records_weather.MP4,,
,hell-s-half-acre,Outside shot of Hells Half Acre Lookout ,Keeping Watch,2021-07-13,Outside shot of Hells Half Acre Lookout ,,Hell's Half Acre,45.64579,-114.62838,,,image;stillimage,image/jpeg,eng,,,image,https://cdil.lib.uidaho.edu/keeping-watch/objects/hell-s-half-acre/outside_shot_hells_half.JPG,https://cdil.lib.uidaho.edu/keeping-watch/objects/small/outside_shot_hells_half_sm.jpg,https://cdil.lib.uidaho.edu/keeping-watch/objects/thumbs/outside_shot_hells_half_th.jpg
,hell-s-half-acre,Patrick McMarron Discusses the Importance of Human Beings on the Lookout,Keeping Watch,2021-07-13,Video of Patrick McMarron discussing the importance of human beings staffing fire lookouts,Patrick McMarron; Hell's Half Acre,Hell's Half Acre,45.64579,-114.62838,,,image;MovingImage,video/mp4,eng,,,video,https://cdil.lib.uidaho.edu/keeping-watch/objects/hell-s-half-acre/Patrick_the_human_being.mp4,,
shattori,,Fumi (Sato) Hattori interview,"Hattori, Fumi (Sato)",,"Fumi (Sato) Hattori looks back on her childhood, her family, and the role of the Japanese Language School on the Japanese community in Tacoma, Washington. Hattori notes how central the Japanese Language School was to culture, community, and social life, and how the school was unique to the time and place. Hattori connects this history with the stories of her parents, her siblings, her children, and her grandchildren.",,"Tacoma, Washingon, United States; Ehime Prefecture, Japan; New Orleans, United States; Tokyo, Japan",,,Tacoma Japanese Language School Project,,record,compound_object,eng,http://rightsstatements.org/vocab/InC-EDU/1.0/,This item is protected by copyright and/or related rights. Permission must be obtained for any use or reproduction which is not educational and not-for-profit. Contact the University of Washington Tacoma Library with inquiries regarding use.,compound_object,,,
,shattori,Fumi (Sato) Hattori audio,,2005-01-27,,,,,,,,sound,audio/mp3,eng,,,audio,http://uwnetid.sharepoint.com/:u:/s/tacomalibrary_digitalscholarship/EQbnZylgjy1FkLF9vj5dvXIBQs0qn8A3EOBPhq_4SDNbGg?e=M4VIQi,,
,shattori,Fumi (Sato) Hattori transcript,,2005-01-27,,,,,,,,text,csv,eng,,,pdf,,,
,shattori,Fumi (Sato) Hattori image,,2005-01-27,,,,,,,,image;stillimage,image/jpeg,eng,,,image,,,
khorita,,Kazumo Horita interview,"Horita, Kazumo",,"Kazumo Horita shares his unique family history and experiences, covering his father's initial arrival to the United States, growing up in Tacoma, and navigating post-camp life. Horita discusses playing baseball all around the country, attending college during World War II as a way to leave incarceration camps, and facing discrimination as a Japanese American in the aftermath of the war. Horita notably remarks on the unique, tight-knit nature of Tacoma's Japanese community due largely in part to the multiple religious institutions and the roles they played in cultivating a sense of community.",,"Fukui Prefecture, Japan; Chicaco, Illinois, United States;",,,Tacoma Japanese Language School Project,,record,compound_object,eng,http://rightsstatements.org/vocab/InC-EDU/1.0/,This item is protected by copyright and/or related rights. Permission must be obtained for any use or reproduction which is not educational and not-for-profit. Contact the University of Washington Tacoma Library with inquiries regarding use.,compound_object,,,
,khorita,Kazumo Horita audio,,2005-03-11,,,,,,,,sound,audio/mp3,eng,,,audio,/objects/khorita_audio_web.mp3,,
,khorita,Kazumo Horita transcript,,2005-03-11,,,,,,,,text,csv,eng,,,pdf,,,
,khorita,Kazumo Horita image,,2005-03-11,,,,,,,,image;stillimage,image/jpeg,eng,,,image,,,
jhayashi,,June Mieko (Shirozu) Hayashi interview,"Hayashi, June Mieko (Shirozu)",,"June Mieko (Shirozu) Hayashi traces her family history from Japan to Tacoma, Washington. Hayashi explores the role of religion in Japanese culture and family life, noting the central role of the various churches in Tacoma in the community.",,"Altadena, California, United States; Longview, Washington, United States; Fukuoka, Japan; Milton, Washington, United States; Jerome, Idaho, United States; Puyallup, Washington, United States; Fife, Washington, United States",,,Tacoma Japanese Language School Project,,record,compound_object,eng,http://rightsstatements.org/vocab/InC-EDU/1.0/,This item is protected by copyright and/or related rights. Permission must be obtained for any use or reproduction which is not educational and not-for-profit. Contact the University of Washington Tacoma Library with inquiries regarding use.,compound_object,,,
,jhayashi,June Mieko (Shirozu) Hayashi transcript,,2005-01-27,,,,,,,,text,csv,eng,,,pdf,,,
,jhayashi,June Mieko (Shirozu) Hayashi audio,,2005-01-28,,,,,,,,sound,audio/mp3,eng,,,audio,,,
,jhayashi,June Mieko (Shirozu) Hayashi image,,2005-01-29,,,,,,,,image;stillimage,image/jpeg,eng,,,image,,,
ctakaoka,,Chizu Takaoka,"Takaoka, Chizu",,"Chizu Takaoka traces her family history from Japan to Tacoma, Washington. She describes her experience at the Japanese Language School and her family life. Takaoka recounts her and her family's experience during and after World War II.",,"Tacoma, Washington, United States; Fukushima, Japan; Tulelake, California, United States; Chicago, Illinois, United States; Seattle, Washington, United States; Spokane, Washington, United States; France",,,Tacoma Japanese Language School Project,,record,compound_object,eng,http://rightsstatements.org/page/InC-EDU/1.0/?language=en,This item is protected by copyright and/or related rights. Permission must be obtained for any use or reproduction which is not educational and not-for-profit. Contact the University of Washington Tacoma Library with inquiries regarding use.,compound_object,,,
,ctakaoka,Chizu Takaoka transcript,,2005-03-12,,,,,,,,text,csv,eng,,,pdf,,,
,ctakaoka,Chizu Takaoka audio,,2005-03-12,,,,,,,,sound,audio/mp3,eng,,,audio,,,
,ctakaoka,Chizu Takaoka image,,2005-03-12,,,,,,,,image;stillimage,image/jpeg,eng,,,image,,,
mtakasugi,,Robert Mitsuhiro Takasugi interview,"Takasugi, Robert Mitsuhiro",,"Robert Mitsuhiro Takasugi reflects on his childhood growing up in Tacoma and attending the Japanese Language school. Takasugi contrasts his experiences attending American public school with the Japanese Language School. In addition to covering family history, Takasugi recounts the moral and cultural lessons he received at the school and examines what it means to be Japanese. ",,"Los Angeles, California, United States; Tacoma, Washington, United States; Nanaimo, British Columbia, Canada; Okayama, Japan; Pinedale, California, United States; Tule Lake, California, United States; Portland, Oregon, United States",,,Tacoma Japanese Language School Project,,record,compound_object,eng,http://rightsstatements.org/vocab/InC-EDU/1.0/,This item is protected by copyright and/or related rights. Permission must be obtained for any use or reproduction which is not educational and not-for-profit. Contact the University of Washington Tacoma Library with inquiries regarding use.,compound_object,,,
,mtakasugi,Robert Mitsuhiro Takasugi transcript,,2005-01-09,,,,,,,,text,csv,eng,,,pdf,,,
,mtakasugi,Robert Mitsuhiro Takasugi audio,,2005-01-09,,,,,,,,sound,audio/mp3,eng,,,audio,,,
,mtakasugi,Robert Mitsuhiro Takasugi image,,2005-01-09,,,,,,,,image;stillimage,image/jpeg,eng,,,image,,,
ttaniguichi,,Taeko Taniguichi Hoshiwara interview,"Taniguichi Hoshiwara, Taeko",,"Taeko Taniguishi Hoshiwara describes growing up in Tacoma, her experiences at the Japanese Language School and her family life in Tacoma, Seattle and Hawaii. Taeko recounts her and her family's experience during and after World War II.",,"Seattle, Washington, United States; Honolulu, Hawaii, United States; Tulelake, California, United States; Kagoshima, Japan; Pinedale, California, United States; Sand Island, Hawaii, United States; Jerome, Arkansas, United States",,,Tacoma Japanese Language School Project,,record,compound_object,eng,http://rightsstatements.org/vocab/InC-EDU/1.0/,This item is protected by copyright and/or related rights. Permission must be obtained for any use or reproduction which is not educational and not-for-profit. Contact the University of Washington Tacoma Library with inquiries regarding use.,compound_object,,,
,ttaniguichi,Taeko Taniguichi Hoshiwara transcript,,2006-03-17,,,,,,,,text,csv,eng,,,pdf,,,
,ttaniguichi,Taeko Taniguichi Hoshiwara audio,,2006-03-17,,,,,,,,sound,audio/mp3,eng,,,audio,,,
,ttaniguichi,Taeko Taniguichi Hoshiwara image,,2006-03-17,,,,,,,,image;stillimage,image/jpeg,eng,,,image,,,
htorimaru,,Hanna Torimaru Interview,"Torimaru, Hanna",,,,,,,Tacoma Japanese Language School Project,,record,compound_object,eng,http://rightsstatements.org/vocab/InC-EDU/1.0/,This item is protected by copyright and/or related rights. Permission must be obtained for any use or reproduction which is not educational and not-for-profit. Contact the University of Washington Tacoma Library with inquiries regarding use.,compound_object,,,
,htorimaru,Hanna Torimaru transcript,,2005-03-12,,,,,,,,text,csv,eng,,,pdf,,,
,htorimaru,Hanna Torimaru audio,,2005-03-12,,,,,,,,sound,audio/mp3,eng,,,audio,,,
,htorimaru,Hanna Torimaru image,,2005-03-12,,,,,,,,image;stillimage,image/jpeg,eng,,,image,,,
pyoshiaki,,Perry Yoshiaki Interview,"Yoshiaki, Perry",,"Perry Yoshiaki recounts his childhood in Tacoma, including discussion of family relations, religion, education, and identity. Perry also describes his memories of Pearl Harbor and being sent to internment camps in California, as well as his family's move to the East Coast following World War II.",,"Naperville, Illinois; Tacoma, Washington; Salt Lake City, Utah; Seattle, Washington; Marugame, Kagawa, Japan; Fife, Washington; Pinedale, California; Tule Lake, California; Central New Jersey; Lakewood, New Jersey; Philadelphia, Pennsylvania; Kyoto, Japan;",,,Tacoma Japanese Language School Project,,record,compound_object,eng,http://rightsstatements.org/vocab/InC-EDU/1.0/,This item is protected by copyright and/or related rights. Permission must be obtained for any use or reproduction which is not educational and not-for-profit. Contact the University of Washington Tacoma Library with inquiries regarding use.,compound_object,,,
,pyoshiaki,Perry Yoshiaki transcript,,2005-03-10,,,,,,,,text,csv,eng,,,pdf,,,
,pyoshiaki,Perry Yoshiaki audio,,2005-03-10,,,,,,,,sound,audio/mp3,eng,,,audio,,,
,pyoshiaki,Perry Yoshiaki image,,2005-03-10,,,,,,,,image;stillimage,image/jpeg,eng,,,image,,,
hyoshioka,,Betty Hiroko (Fukuhara) Yoshioka interview,"Yoshioka, Betty Hiroko (Fukuhara)",,"Hiroko ""Betty"" Fukuhara Yoshioka describes her experiences as a Nisei woman. She did not attend the Japanese Language School, but describes her experiences growing up in Tacoma, attending Central Elementary School and Stadium High School, having her father taken away after the bombing of Pearl Harbor, being sent to an internment camp, and ultimately moving to Chicago. Yoshioka especially recalls her parents and her five sisters, and she discusses how her children and grandchildren interact with their family identity and history.",,,,,Tacoma Japanese Language School Project,,record,compound_object,eng,http://rightsstatements.org/vocab/InC-EDU/1.0/,This item is protected by copyright and/or related rights. Permission must be obtained for any use or reproduction which is not educational and not-for-profit. Contact the University of Washington Tacoma Library with inquiries regarding use.,compound_object,,/objects/small/hyoshioka_image_sm.jpg,/objects/thumbs/hyoshioka_image_th.jpg
,hyoshioka,Betty Hiroko (Fukuhara) Yoshioka audio,,2005-03-10,,,,,,,,sound,audio/mp3,eng,,,audio,https://uwnetid.sharepoint.com/:u:/s/tacomalibrary_digitalscholarship/EeXY5tW2VytMvTBKCAgI3dsBQp0rrws7vVyT7u5_voHhpQ?e=CSnPXM,,
,hyoshioka,Betty Hiroko (Fukuhara) Yoshioka image,,2005-03-10,,,,,,,,image;stillimage,image/jpeg,eng,,,image,/objects/hyoshioka_image.JPG,/objects/small/hyoshioka_image_sm.jpg,/objects/thumbs/hyoshioka_image_th.jpg
,hyoshioka,Betty Hiroko (Fukuhara) Yoshioka transcript,,2005-03-10,,,,,,,,text,csv,eng,,,pdf,/objects/hyoshioka.csv,,
largegroup1927,,"Group of students and faculty outside the rear of the Tacoma Japanese Language School, May 22, 1927","Boland, M. D. (Marvin Dement)",1927-05-22,"Written on photo: Tacoma Kokugo Gakko Kenchiku Kinen Narabina Shugiyoshiki. May 22nd, 1927. Translation: Commemoration of the construction of the school and closing ceremony for the end of the school year. Written on verso: Fujimoto.  ",,"Tacoma, Washington",,,Photographs of the Tacoma Japanese Language School and Tacoma Hongwanji Buddhist Church. PH Coll 1020,,image,image/jpeg,eng,,,image,https://digitalcollections.lib.washington.edu/digital/iiif/panoram/121/full/full/0/default.jpg,,
largegroup1934,,"Large group of students and adults in front of the Tacoma Japanese Language School gathered to celebrate the visit of Duke Tokugawa, March 4, 1934","Boland, M. D. (Marvin Dement)",1934,"Written on photo in Japanese: SHoWA 9-NEN 3-GATSU 4-KA TOGUGAWA KoSHAKU KAKKA GOSHI KINEN SATUEI Translation: Commemorating the visit of his excellency Duke Tokugawa to Tacoma, WA on March 4, 1934. Handwritten on verso in Japanese: Fujimoto.","Japanese students--Washington (State)--Tacoma; School buildings--Washington (State)--Tacoma; Nihongo Gakko (Tacoma, Wash.)--Students; Portraits, Group--Washington (State)--Tacoma","Tacoma, Washington",,,Photographs of the Tacoma Japanese Language School and Tacoma Hongwanji Buddhist Church. PH Coll 1021,,image,image/jpeg,eng,,,image,https://digitalcollections.lib.washington.edu/digital/iiif/panoram/117/full/full/0/default.jpg,,
largegroup1931,,"Large group of students and faculty outside the front of the Tacoma Japanese Language School on the 20th anniversary of the school, August 30, 1931",Chapin Bowen Inc.,1931-08-30,"Written in Japanese (translation): 20th anniversary of the Tacoma Japanese Language School taken August 30, 1931.",,"Tacoma, Washington",,,Photographs of the Tacoma Japanese Language School and Tacoma Hongwanji Buddhist Church. PH Coll 1020,,image,image/jpeg,eng,,,image,https://digitalcollections.lib.washington.edu/digital/iiif/panoram/115/full/full/0/default.jpg,,
largegroup1937,,"Large group of students and faculty kneeling and standing outside the front of the Tacoma Japanese Language School, May 23, 1937",,1937-05-23,Handwritten on verso: HATA,"Japanese students--Washington (State)--Tacoma; School buildings--Washington (State)--Tacoma; Nihongo Gakko (Tacoma, Wash.)--Students; Nihongo Gakko (Tacoma, Wash.)--Faculty; Portraits, Group--Washington (State)--Tacoma","Tacoma, Washington",,,Photographs of the Tacoma Japanese Language School and Tacoma Hongwanji Buddhist Church. PH Coll 1021,,image,image/jpeg,eng,,,image,https://digitalcollections.lib.washington.edu/digital/iiif/panoram/120/full/full/0/default.jpg,,
largegroup1933,,"Large group of students, faculty, and visiting military officers standing outside the front of the Tacoma Japanese Language School, approximately 1933","Boland, M. D. (Marvin Dement)",Approximately 1933,"Written on photo: Photograph commemorating the visit of military officers to Tacoma, WA. Fujimoto. This is possibly the visit of officers from the Imperial Japanese flagship and a Japanese naval training ship, the Yakumo and Iwate. The ships came to Tacoma on April 1, 1933 and stayed several days. They were open for tours and drew large crowds. Over 1500 men on the ships were allowed leave in Tacoma. The photographer's number on the photograph indicates that it was made during this time period","Japanese students--Washington (State)--Tacoma; School buildings--Washington (State)--Tacoma; Nihongo Gakko (Tacoma, Wash.)--Students; Nihongo Gakko (Tacoma, Wash.)--Faculty; Military officers--Washington (State)--Tacoma","Tacoma, Washington",,,Photographs of the Tacoma Japanese Language School and Tacoma Hongwanji Buddhist Church. PH Coll 1022,,image,image/jpeg,eng,,,image,https://digitalcollections.lib.washington.edu/digital/iiif/panoram/119/full/full/0/default.jpg,,
building1979,,Japanese Language School above Buddhist Temple (1979),"Cysewski, Stephen",1979,Looking northeast,,"Tacoma, Washington",,,"Tacoma Public Library, Northwest Room",,image,image/jpeg,eng,Contact the Northwest Room at Tacoma Public Library for a copy of this image.,All rights reserved.,image,https://digitalcollections.lib.washington.edu/digital/iiif/tacoma/1374/full/full/0/default.jpg,,
booktrailer,,Tacoma's Japanese Language School: An Oral History,"Hoffman, Lisa; Hanneman, Mary",2012,Graduates of the Japanese Language School in Tacoma (1911-1942) recall their days at the school and what it meant to the community.,,"Tacoma, Washington",,,UW Tacoma,,image;MovingImage,video/mp4,eng,Contact UW Tacoma. ,All rights reserved.,video,https://youtu.be/V_p8Zmz_nBk,,