timestamp,speaker,words,tags
,Perry,"Yeah, I, it was a very happy time, you know. Well, no, I guess kids are mostly happy anyway, growing up. They have happy childhoods a lot. So my childhood was not very different from anybody else. Just, it was pretty, pretty happy, no bad… Until the war started, you know, there was nothing. No bad memories.",
,Lisa,"I have one last question, sorry. Do you, given the story that you told us earlier about meeting the boys from Stockton, and their father had been shot, do you think that children growing up in California, for example, had different childhoods than yours, as you talked to them and met them in camp and other places in your life? Do you think Tacoma was unique, is I guess is the question.",
,Perry,"I, I don’t, I don’t, I never thought about them, but I, you know, I think, I don’t, I, I don’t know other communities, so I really can’t say, but I think there was less... Well, I, I just get the feeling that there was less animosity, but, you know, I was so small… I, my dad probably feel differently, I think he had, there were more racial incidents that he experienced. But he, he never, he never expressed, he never verbalized any, any thoughts on that matter. I, I think he, that he did experience racial prejudice, and, you know, I don’t remember any, I, where he, where he related such incidents, but I, you know, I sort of remember him expressing this feeling that there were ra-, there was racial prejudice against Japanese. But not, there were no, you know... The only, I remember he, he was mugged once, you know, but and he carried a pis-, after that he carried a pistol, so… But that’s all I remember.",
,Lisa,That was in Tacoma?,
,Perry,Uh-huh.,
,Lisa,Great.,
,Lisa,"Well thank you very much. We really appreciate your participation and your, your candor. It’s really interesting. Thank you.",
,Perry,"Okay, I hope I was helpful.",
,Mary,"Yeah, of course. Yeah.",