timestamp,speaker,words,tags
,Perry,"Yeah, my parents, my moth-, my, my, my dad was very easygoing, he didn’t, you know he was pretty carefree, I think, at heart, although he was, you know, he was always at home, you know, he wasn’t, he didn’t go out with other men, other friends. But he didn’t spend too much time lecturing us, or advising us, or uh... And my mother usually was the one that, you know once she, she mostly stressed just being good, and then, you know, reading the Bi-, following the Bible, and then... She used to say that, you know, just, just, just be a good person, but she didn’t, you know, she didn’t break it down much further than that, you know, exactly how to be good, just be good. So that’s what I remember. I know she did a lot of that.",
,Lisa,"So how did you, [truck backing up] if she didn’t break it down, how did you take that? What, what did it mean to you to be a good person? To be good?",
,Perry,"I remember the Ten Commandments made a big impression on me. [beeping ends] I tried to follow that a long time. I mean, for a long time. But then I remember, well I guess I don’t remember too many, and I know the Sunday school lessons, they used to have little four-page pamphlets, and little Bible stories. So I think that made a, they made a, they made a big impression on me.",
0:39:55,Perry,"So yeah, I think, you know, I didn’t understand the Christianity, but I think I tried to follow the… The Ten Commandments made a big, pretty deep, must have made a pretty deep impression on me. So, even though, you know, I never analyzed it very, very much. But just und-, I tried to follow it, just took it literally, you know, for a long time. And then my moth-, my mother always telling me “Be good,” don’t, you know. But she wasn’t, you know, like I said, very specific.",
,Lisa,"So one thing we’re trying to understand in this project is what role the language school played in the community and in people’s lives. And Tacoma’s school is unique because it’s a non-denominational school, whereas a lot of the other language schools on the West Coast were started by either the Methodist Church or the Buddhist Church. So if you think back on your life and your experience, especially in relation to your time at Sunday School, another school-type atmosphere or institution, do you think that it mattered that the language school wasn’t, non-denominational? Did it play a big role in the community or, and in your home life?",
,Perry,"I think it just subcon-, not something I thought about consciously, but you know, it just made me… It just instilled in me that, that I was a Japanese person, and that, you know that the people around, the people I saw in school, these, these are the people that I’m like, and that are like me. And that’s, that’s my group. That, that’s the main thing, and now, um, that’s – but, be as far as my moral character, you know I, I don’t, I’m not conscious of it being, uh, playing a very big part of my, my life. But I think today, you know, I’m much more comfortable with being around Japanese, and even though I live in a very white community, and, you know, I feel, I feel, I, I come to, [scratching his nose] I’ve just, just lately starting coming to Japanese-American church in Chicago. And I feel very, much more comfortable there, so... Then I think that maybe the, maybe the school, you know, put that, started it all, and so...",
,Mary,"You said earlier, that when talking about this sort of thing, that you didn’t really have any thoughts or feelings about racism or prejudice when you were younger – but then after the war or maybe when you were older, did you have any?",
,Perry,"Yeah, I think, you know, when I was growing up, I would hear about Japanese atrocities and then, you know, then I would, that gave me, so I think it gave me guilt, guilt feelings, you know, that they would do, that things like that were going on that they were doing. And yeah, I would, I would feel ashamed, you know, I would feel, you know, I would feel sort of maybe inferior, because they were doing such things. That was around when I was around, maybe around eleven or twelve, not, no maybe af-, right after that. And then being, being put in camps, I think it really, subconsciously, it, I felt that, you know I felt sort of, I felt, I think I felt maybe inferior, because of the, you know, being put away for being Japanese.",
0:44:51,Perry,"And it took a while for, I’m not sure if that is the only reason, but I think it affected me subconsciously, or maybe even consciously. That, I think, yeah, I think that I really did, psychologically I was hurt by the, by the war and being put away.",
,Mary,"It seems like you would not have been so young that it wouldn’t have mattered, but you weren’t so old at that time that you would have had a strong identity and strong personality, so maybe you were a particularly vulnerable age, you know, when your family was sent to the camps.",
,Perry,"Yeah, you know, I couldn’t verbalize what I, what I was feeling, or maybe I couldn’t even understand what was going on. But I was feeling something and, you know, I couldn’t, something I couldn’t even talk about, for a lot, so it just was inside, maybe for a long time. And gradually, I began to think about it, and work it out, so, you know, I can, at least I can talk, could verbalize a little bit more, and so.",
,Lisa,Where were you when Pearl Harbor happened?,
,Perry,Pardon me?,
,Lisa,Where were you when Pearl Harbor happened?,
,Perry,"Okay, yeah, I was in a movie, and we were with a couple, a couple of friends, and we came out and we were walking home, and then, you know, they had, they were shouting a headline on a newspaper about the war, just Pearl Harbor, so-. It was a big shock.",
,Lisa,"And what did you do, then?",
,Perry,"I, I don’t, I don’t remember [truck backing up]. Yeah, that was, yeah it was a very sa-, a really shocking day. But I didn’t, you know, I didn’t, I guess I didn’t know what was going to happen and I really didn’t know what to make of it all. And we didn’t, we never really sat down and discussed what it all meant.",
,Mary,Do you remember your parents’ reaction at all?,
,Perry,No I don’t remember.,
,Mary,Or your sister?,
,Perry,No.,
,Lisa,"Did anything happen in school? Were there any announcements, things like that?",
,Perry,"No, I, I meant, I didn’t go to school for a couple of days after that, and then, and I understand the principal had a meeting and with the whole student body, and he just said, you know, that, words to the effect that, you know, they would, that I was not to be treated poorly, and I had nothing to do with what happened. That’s what I understand, I don’t know what exactly what happened. So never, so there were no incidents at school that I remember. So I was… Yeah, I don’t, I don’t remember too much about what was going on.",
,Lisa,"[Camera jogs around] Why didn’t you go to school for a few days? Were, were your parents afraid? Or were you afraid?",
,Perry,"I, I don’t know, I don’t remember why, exactly why I didn’t go.",
,Lisa,"Did your sister also stay home, or do you remember if she went to school?",
,Perry,"I, I, I think she stayed home, but I’m not sure. I don’t know exactly, I don’t remember what exactly what happened.",
,Lisa,"How about when the relocation order came, do you remember what happened in your family and packing things up? Where you went?",
,Perry,"Yeah, it, I don’t remember, I remember we just had to start get-, getting rid of things and our, the grocery store, uh, and we had to get, my dad had to sell everything, get rid of everything. I remember, uh, though maybe towards the end, towards, one of the last days before closing the store, he had to, I guess he had like a party, where he, where the peop-, where he gave away a lot of the food.",
0:50:09,Perry,"And so, I know how, I was pretty… Actually I think I… I remember I was, I cried during that party, and I remember my mother, my parents being concerned because I was crying. I don’t know exactly why I was crying, but, but I remember that. But I remember it happened. Yeah, I don’t have too many memories of the last year that we were there.",
,Perry,"I guess there were, you know, a couple of, maybe there was one guy I remember in the neighborhood that was, he would call us names, he would call me a name, called me a name a couple of times. But other than that… Oh, and then I, I would, I heard, overheard someone telling peop-, some people talking, strangers talking, you know, mentioning about, I remember about “Japs,” and so, but you know they, it wasn’t directed towards me. They were just talk, uh talking. I would, I would overhear them. But there were no, you know, I wasn’t beat up or things thrown at me, or anything like that.",
,Lisa,Are there stories? Did you hear of that happening to other people?,
,Perry,"Yeah, later on, you know, I met some, well they, especially in class there was a couple of young brothers whose father was sho-, in, was sh-, they were from Stockton, California. And they were sh-, his, their father was killed on the day when Pearl Harbor happened. So…",
,Lisa,You met them in camp.,
,Perry,Yes.,
,Lisa,Wow.,
,Perry,"But not, I’d never heard anything happen in, happening in Tacoma.",
,Lisa,"So you were quite young still, when you must have heard those kinds of stories in camp.",
,Perry,"Yeah, I was around ten when I, in fort-, in fort-, well I guess in ’42 I must have been eleven. So, about the sixth, the sixth grade.",
,Lisa,"Where did you go, where did your family go?",
,Perry,"We went to Pinedale, California, near, I think it’s near Fres-, Fresno. Then, then after a couple months we went up to Tule Lake, and then I stayed there ‘til November of ’45. And then my dad went to, and our family went to New Jersey.",
,Mary,"After the, after release, then, your family went to New Jersey.",
,Perry,"Yeah, yeah, November, ’45.",
,Mary,And why New Jersey?,
,Perry,Pardon me?,
,Mary,Why New Jersey?,
,Perry,"Umm, they didn’t want, they thought there would be, there would be too much prejudice in the West Coa-, Coast, so they wanted to go east.",
,Mary,Mm-hmm.,
,Perry,"And I think there were relocation people, you know, that had, that knew of places where they could go and find, and had jobs available. So…",
,Mary,What kind of job did your father find then?,
,Perry,"He deci-, he looked for, well he ended up chicken, doing chicken farming.",
,Lisa,And we’ve heard of several people doing this-.,
,Mary,In New Jersey.,
,Lisa,Yeah.,
,Perry,Uh-huh. Central Jersey.,
,Lisa,Yeah.,
,Perry,"They, yeah it was, I guess they had chicken farms to supply New York Ci- well New York and I guess Philadelphia was right in between. So, and the, there was a lot of farmland there. [camera bumped] You know, it wasn’t, there were no big cities at all. And I guess they had started, the farms that were started during World War II, and there were a lot of Jewish farms, actually. And they were, they were looking for help, so...",
0:55:02,Perry,"A lot of Japanese went down further south in Seabrook, New Jersey. There was a, but we never, I don’t know why they didn’t choose to go over there. I would think that, you know, he knew, my dad knew more about vegetable farming than working on a chicken farm. I don’t know why they decided not to do that. And I never asked them. But he didn’t, he didn’t work too long, I think maybe about five years. He was, he was around sixty, I think, when we moved to New Jersey.",
,Perry,"And then my, my sister went to nursing school, and then she became, she was a nurse, and then she got married, and they had a child. And my dad, no he, I didn’t, he thought that he didn’t, he couldn’t work mu- I guess he was around sixty-five, so he, he was getting his social security, and they went to live with my sister and her family. And let’s see, I was, at that time I was in the, I was in the service, I just started. It was the Korean War going on, so, in 1950 I was in the Air Force, and they had gone to live, my parents had gone to live with my sister, so… Well, they coul-, they couldn’t, there was friction with my brother-in-law and my mother especially, so they – they went back, they went to work as a, I guess, I think he worked for a ri-, a rich couple, well pretty rich couple in, outside of Philadelphia. They were getting room and board, and so...",
,Perry,"And then when I, when I got out of the service I lived with my parents. We went into the country, uh, near Lakewood, New Jersey. But we star-, well we, they started out right after the war. And then they ended up in, let’s see… I moved out after I got mar-, I got married and then moved to Illinois, and then my parents moved back with my, with my sister and her husband, and I guess they got along better than they did the first time, so... And my parents, that’s, uh, they spent the last years of their lives with my pa-, with my sister and her husband.",
,Mary,So you finished high school in New Jersey?,
,Perry,Mm-hmm.,
,Mary,"And then when, when did you enlist in the Air Force?",
,Perry,"Umm, in July, about one year after, after I graduated. I was working, when I was in, when I was in high school, I got a job, I think one summer, working in a hotel as a, making salads. And so then I think the summer after I graduate, graduated… Oh, I was encouraged to go to college, but I just didn’t, I just didn’t think of myself as a college person. So I just took, uh… So somehow I got in touch with the person that I worked for the previous summer and went to work as a, doing the same job, making salads. At, at a resort in upst-, in, near New York City. And then, and then that, in that fall I, I got another job, the same kind of a job, maybe it was a bus boy, in, near Philadelphia.",
1:00:05,Perry,"And then, then I, then I got a job in Philadelphia doing, as a salad man. And then, then I went, then in ’51 I went into the service. And then, let’s see, then after four years I, uh, yeah let’s see, I was working as a technician, electronic technician, and then I did, I did that for about maybe two years, two or two years, I guess, and I decided to go back to college.",
,Lisa,"That was after those, after the service you were the technician? You did that?",
,Perry,Yes.,
,Lisa,Okay.,
,Perry,"Maybe two to four years, I’m, I’m not, let’s see, how did that work out? Yeah, I think it was maybe four years as a technician. Then I went back to school, college, not back, but I went to college. Yeah, I went and got a degree in, in math, actually. And then I went to work for, there was AT&T at that time, then I was a engineer for about thirty-four years.",
,Lisa,Wow.,
,Perry,So. Then I’ve been retired since ’95.,
,Lisa,"What was it like, going to high school in New Jersey, after coming out of the internment camp?",
,Perry,"And I was, yeah, we, we were, I was the only, well there was one other Japanese-American in the school. And it was a small town, about 12,000. Mostly, well they were all Caucasians except it was a resort town for Jewish people that would come there, so there was a lot of Jewish hotels and maybe all the smart kids in high school were Jewish. And so, in the, they had the college preparatory school, uh, classes, and so I, I was, so all my classmates were Jewish. But, you know, they don’t, I didn’t associate, my friends were not Jewish. They were… I never saw my friends in school, you know. The guys that I hang out with, hung out with. I, oh I used to go to YMCA a lot, and there were no, there were no Jews there, so... So, I got, and I got pretty good grades, and but, so I was encouraged to go to high sch-, uh college, but I never did that. I think I, you know, so high school was a good experience. It was a good sch-, pretty good school, so I got a pretty good education. And a lot, a lot of kids that wanted to go college, you know, they, they went on and went to good schools. But most of them went to the state school, in New Jersey, Rut-, Rutgers, which is a, I think had a pretty good reputation. But I, I never, no the Jewish stu-, all the, they all hang out together and I never, I never did join their, join them. So my friends, my friends were, they never, they never went on to college. Why, actually, at the time they didn’t go on to college, but so… I was sort of, you know, I didn’t really, I wasn’t that too close with the guys I went around with.",
1:05:02,Lisa,"And how about that going into the service. I mean it, given your experiences and your life, and having been put into the camps, did you have any…?",
,Perry,"No, I didn’t feel any bad, you know, I didn’t, uh… It was just something I had to deal with, so, I just went. I never resented it. And my parents never spoke badly about it.",
,Mary,"By that time, the, the services had been integrated for a few years.",
,Perry,"Mm-hmm, oh yeah. It was, there was no, I had, yeah, there was no bad experience in service, that I knew of, that I knew of, so...",
,Mary,Do you know if your parents ever considered returning to Tacoma? After being released from the camps?,
,Perry,"No, they didn’t. They never talked about going, they were happy in New Jersey.",
,Mary,"Uh-huh. I mean, so when, when it became clear that the camps were going to be closed down and people were going to be able to go, just leave, they never, to your knowledge, discussed returning to Tacoma.",
,Perry,"No, they just, they just said that there was, they felt there was too much prejudice and they want, it might be dangerous going back there, and there was… I don’t know, it was probably very painful for them, you know, to go back there, start all over again, and you know, new, old familiar surroundings.",
,Lisa,Where did you meet your wife?,
,Perry,"Actually, I met her through my, my cousin, he knew my, he well knew… Well she, she used to take lessons, uh, sewing lessons, here from my cousin, who lived, and so that’s how I met her. He knew, uh, he knew I was looking for a wife, so.",
,Lisa,Was that in New Jersey? Was she also?,
,Perry,"No, she was, this was in, he was in Ky-, uh Japan.",
,Lisa,"Oh, okay.",
,Perry,"In Kyoto, as a matter of fact, big, a big city, pretty big city.",
,Lisa,Yeah.,
,Mary,So your wife is from Japan.,
,Perry,Yes.,
,Lisa,"And did you go to Japan to meet her, or did she come here?",
,Perry,"No, no I went there. I had to, I met, I met her, the whole family was, I met, I came over and visited my, my cousin, and then one day I went to a hotel, and I met her family and my, my cousin was with me, my cousin and his wife and so... Then that, they looked at me and they looked me over, and said “Okay” [laughter]. And boy, there was, well you know, I was ready for marriage. So, I had, I, they went… Now, we lived in the count-, in New Jersey when I was living with my parents, and they had retired, and there weren’t many opportunities for me to meet any Japanese, Japanese at all, so... So, I, I think I was over thirty when I, yeah when I finished school around thirty-three, I think.",
,Lisa,And you have two children? Will you tell us a little about them?,
,Perry,"Yes, my, my daughter is thirty-one and my son is twenty-nine. And, um, she went to medical school and she finished her Residency at Yale, and she’s been working in a native hospital in Anchorage for about, about nine months, I think. My son is in his, he’s an intern at Illinois Masonic Hospital, in north side of Chicago. So he, he wants to go into anesthesiology.",
1:10:20,Lisa,Great.,
,Perry,And he just got married. Over the weekend [grins proudly].,
,Lisa,"Oh, congratulations!",
,Mary,"Wow, you’ve been busy this week.",
,Perry,"So I’m kind of, I’m kind of in shock.",
,Lisa,I bet!,
,Perry,I’m not really over it yet.,
,Lisa,And is your daughter-in-law Japanese?,
,Perry,"No, she’s Chi-, her parents are from Taiwan.",
,Lisa,Oh.,
,Perry,"They, they live in St. Louis. She grew up in St. Louis, and she’s, I think she’s twenty-seven. She went to St. Louis Universi-, uh, Washington University, and so she’s been working three or four year-, uh, maybe five years in something, uh let’s see, mergers and acquisitions.",
,Lisa,Wow.,
,Perry,"And yeah, so, she comes from a very large family. Her, her parents have several sib-, siblings, so...",
,Mary,"So it was a big wedding, it sounds like.",
,Perry,"Yes, very big.",
,Mary,"Did, uh, were Chinese and Japanese traditions represented at the wedding at all?",
,Perry,"They, they had, well they had two sets of cups, and one Japanese and then the other was Chinese, and they, they poured, I think it was tea, and supposedly sake, and they both sipped the drink. And then, then they served us with the Chinese tea, both, uh, both sets of parents, so... They tried, they tried to bring in the, the old customs during the ceremony.",
,Lisa,Did they kneel in front of you?,
,Perry,Yes.,
,Lisa,To serve you the tea?,
,Perry,"That was the Chinese way, I think.",
,Lisa,"Have you, um, what kinds of things, if any, have you told your children about growing up in Tacoma?",
,Perry,"Not, not too much, but I, we did go back, you know there was a reunion several years ago, and so the four of us went back together, and I to-, tried to go back to where we grow up, grew up, but our houses were all, were gone, and both houses were gone. So, did, but at least they got to see where I grew up. And saw some of the surround- Seattle, and so they think, they enjoyed that.",
,Lisa,Was that the first time you’d been back to Tacoma?,
,Perry,"No, I, I was briefly back maybe for a couple of days. You know, while I was working I got a chance to go on a field trip to Seattle. But that was the only time I was back.",
,Lisa,Are there any things you think you want your children to know? Reflecting back at this point in your life.,
,Perry,Mm-hmm.,
,Lisa,"What kinds of things would those be, if any?",
,Perry,"Well, I, I think… I wish that they had a, they could get an idea of what my childhood was like, you know, [siren begins in background] look and see what my or-, where I, what my origins were, and uh, maybe some of the, what could have influenced my life. Yeah, I think that. Do you think Tacoma is a blue-collar town? [siren gone] Or is it more of a, I don’t know, college town. I guess it’s going to be a college town now.",
1:14:58,Lisa,It’s changing.,
,Mary,"Gosh, it’s definitely not a blue-collar foundation, though. And the military has been real important there, Fort Lewis and McChord, and Camp Murray, and so that’s, has left a real strong imprint on that city, particularly since the war.",
,Perry,Mm-hmm.,
,Lisa,"Yeah, there’s certainly a lot of transitions going on, and part of that is a shift in, in the population, but it’s not, at this point it’s not a major shift, I’d say, in Tacoma.",
,Lisa,"So if, just, I’m curious, because you said, you know, [leans forward and camera goes slightly out of focus] “what may have been those things that have influenced me in my life,” I mean, if you think of them, could you list a couple, and would the language school be in that list?",
,Perry,"Yeah, I, I think the language school, you know, it just, you know, I, made me feel that I was a, a Japanese, not an Ameri-, an American. I always, I think I always thought of myself as being Japanese, and not an American, that’s all. You know, when I went to get married, you know, I didn’t think, I didn’t think I’d look for a Japanese wife, so that was a big influence. Let’s see, what else. [sits back, camera refocuses] I, I maybe, well you know friends, I feel more comfortable being with Japanese…but let’s see. Umm, you know, I think Tacoma being a blue-collar town, I think that…not a, not a…more of an intellectual community, so maybe that had an influence on me, too. So…",
,Perry,"You know, I think I had a, sort of a, more of a egalitarian view of people, maybe subconsciously that came from the school… Nothing, no, no lessons that, you know, were verbally taught, or, I think maybe I, some of that came from the school. You know, but there’s nothing that I could pinpoint and say that, “Well that was it.” That’s when that happened, or… But it just only be over a period of time.",
,Lisa,"Some of, some of the other people we’ve talked to have said that their, they actually have very happy memories of childhood, and that seems especially true for the children who grew up within those, kind of where the Japanese businesses tend to be, tended to be. In that kind of downtown core.",
,Perry,Uh-huh.,
,Lisa,"Because it seems there lives were, as one person said, kind of insulated, in a sense, and it was all about the Japanese-American community. Do you think, do you think that could be true, and do you think because you lived a little bit outside of that core part of the town that your experiences might be different from theirs?",
,Perry,"Yeah, I think it was, it was different. But we did get to meet other Japanese at Steilacoom Bea-, Steilacoom Beach. And that was a very, you know, I had a lot of, that was when probably when I was the happiest, you know, when I was on, playing on the beach and playing, playing in the water, and being around, and having things to, good things to eat, and staying late at night, and shooting off firecrackers, and – or fireworks. So, yeah, I have a lot of happy memories. But not so much in the downtown area. So…yeah, we never, we never got down there too much. Just during the school hours.",
1:20:06,Lisa,"So are there, are there any other memories or thoughts about the language school or growing up in Tacoma that you’d like to share?",
