timestamp,speaker,words,tags
,Lisa,"Do we need more sound tests, or?",
,Camera man,I think we’re all set.,
,Mary,Okay.,
,Mary,"Well this is an interview with Mr. Perry Yoshiako, Yoshiaki Yano. He’s 73, he’s from Naperville, Illinois. We are in Chicago, Illinois, right now. It’s March 10th, 2005. I’m Mary Hanneman, from University of Washington, Tacoma.",
,Lisa,"And I’m Lisa Hoffman, also from the University of Washington, Tacoma.",
,Lisa,"So thank you very much for joining us today, and we just want to start out with, um, a few questions about your background, so if you could tell us when and where you were born, and if you have any siblings.",
,Perry,"Yeah, I was born in June, on June 2nd, 1931, I think Tacoma General Hospital. And I have, I’ve a sister five years older than me. Her name is Masako Mae, and Matsumori now. And she lives near Salt Lake City, with her, with her husband.",
,Lisa,"Great. And-. Oh, I’m sorry.",
,Perry,"No, go ahead.",
,Lisa,"Um, it, it’s just the two of you?",
,Perry,Yes.,
,Lisa,"You and your sister? And do you know when your parents came to the United States? And if they, where did they go first?",
,Perry,"I think, I think my, my father came in 1906, and I guess he came Seattle first. Then he, uh, went back and he got married and brought my, uh, my mother over – 1924. And I think he just, that was the, about the last of the, I think [cracking noise] in ’24, that was the last, she wouldn’t have been able to come after that. Because of the, there was, I guess there was a law passed. And in 1906, I think, after that there was, they allowed family members to come, but not immigrants. So in both cases, it was the last year for them to get over here.",
,Mary,So your father came in 1906.,
,Perry,"I believe so, yes.",
,Mary,"And then married in 1924, about. So-.",
,Perry,"Yeah, I guess.",
,Mary,"Sounds like he was maybe old, quite a bit older than your mother? Or-?",
,Perry,"He, yeah, actually he was. He was about thirteen years older.",
,Mary,Uh-huh.,
,Lisa,"How, how did they meet? Was that an arranged marriage?",
,Perry,"Yes. Yeah, I don’t know too-- I remember he had a very good friend that went to the same scho-, high school that he did in Japan, and I guess this fellow was, was pretty mature, or more maybe more so than my dad. So I remember, so my, my grandfather asked him to look out for my dad, and so they were pretty close. And then – so when this fellow ca-, went back to Japan, he got married, and he married, actually married my mother’s sister. And then he sort of thought it was a good idea for my dad to come back and marry his sister, I mean her, I guess you know–",
,"Mary, Lisa",His wife’s sister.,
,Perry,Right. So that’s what happened.,
,Lisa,So they were all from the same area in Japan?,
,Perry,Yes.,
,Lisa,Where was that?,
,Perry,"It was a ci-, it was a small city in Ma-, called Marugame, in Shikoku. It was a prefecture – Kagawaken. So, we were back there once, it was a pretty nice town. We never, we met, we didn’t meet too many of the relatives, but there’s not, apparently there’s not too many left.",
,Mary,When did you go back?,
,Perry,"Oh, I, gee, it was maybe about ten years ago.",
,"Lisa, Mary",Oh.,
,Perry,"We went back as a, the four of us were able to go back.",
,Mary,"Oh, how neat.",
,Lisa,"Oh, wow.",
,Perry,"To go back to our, or their hometown. Do a little sight-seeing.",
,Lisa,Fantastic.,
0:05:02,Mary,What did your father do in Tacoma?,
,Perry,"He was a, at one time he was a-. Well he, I think he worked a lot as a farmer, you know, working for other farm-, for a farmer. And then he went, he was a, he owned a, a pool hall at one time, with a friend. And then after he got married, he didn’t, he thought he should do something more, more respectable, I guess, so--. But so he, he used to go and, on a truck and sell vegetables, uh, fruits and vegetables. And he did that for a while. And then, when I was around four or five, he bought a, well he rented a grocery store, and they, that’s uh, so he did that, he did that for about four or five years, before-. Then the war started.",
,Mary,Uh-huh. Do you remember the name of the grocery store?,
,Perry,Probably just Yao’s Grocery.,
,Mary,And where did your family live?,
,Perry,"I think it was a corner of 19th and K – that was our last address. And then before that we lived, it was on an alley, I think it was below, between Fawcett and Market Street, on s-, on 17th. 17th or fif-, 17th or 15th, I’m not sure.",
,Lisa,Do you know how long your father stayed in Seattle when he first came?,
,Perry,"No, he, he was, he moved. Apparently he moved around quite a bit. I remember him talking about being in C-, around San Francisco-.",
,Lisa,Oh.,
,Perry,"And then I’m not sure if that, I guess he was still farming, but-.",
,Lisa,So-.,
,Perry,"Then he went, but most of the time I think he spent in, around Tacoma or Seattle, Puyallup, along the Puyallup. There’s a place called Fife near Tacoma, and there, I guess it’s a lot, used to be a lot of farms there. And he used to work on those farms. But I’m not sure, you know, how long he spent in each location.",
,Lisa,"So why do you think he ended up going back to Tacoma? Were there friends there? Other connections? What, what, was there anything in particular that drew him?",
,Perry,"No, I, I really, I really, I really couldn’t say what the-. I know there was a, probably a lot better, I mean more, bigger community of Japanese there, so-. But other than that, I don’t know.",
,Mary,Did your mother work outside the home?,
,Perry,"No, she never – oh later, after, after the war she did, she had, she did work, but not, not, well, maybe, uh, no, on a farm. My dad was working as a, on a chicken farm, and then my, my, my mother would do some, I think grading the chick-, of the eggs. So. But bef-, but when we were growing up she never worked at all, except maybe she worked in the grocery store.",
,Mary,So in your father’s grocery store.,
,Perry,Pardon me?,
,Mary,In your father’s grocery store.,
,Perry,Yes.,
,Lisa,Did your parents speak English?,
,Perry,"Uh, well, just enough to, you know, run a grocery store. It was in a Caucasian neighborhood, so.",
,Mary,Do you know where it was?,
,Perry,19th and K.,
,Lisa,"So that was the grocery, okay. And so what language would you speak at home with your parents?",
,Perry,Japanese.,
,Lisa,"And how about when you spoke with your sister, or your friends, what would you speak?",
,Perry,Probably English.,
,Mary,"Do you remember going to school, and did you know English when you entered first grade?",
,Perry,"Uh, I would think so. Yeah, I think so…yeah I don’t remember my, too much of my friends when I was that young, you know, before, before grade school. Huh. Yeah, I, yeah, I, well we, I don’t know if I spoke, I guess most of my close friends were Niseis, too. But I really don’t remember if we spoke English or Jap-. I, I think we spoke English.",
0:10:24,Lisa,And which elementary school did you go to?,
,Perry,"I went, I think I went to Central for one year, and then I went to Stanley for four or five years.",
,Lisa,"And do you remember why you transferred, you switched schools?",
,Perry,"Oh, because, because we moved. We moved to 19th and K, and that was, that was closer, I, yeah, that was closer.",
,Mary,Were there more Nisei students at Central than at Stanley?,
,Perry,"Yes. Yeah w-, I think we were, I was, I was the only Japanese at Stanley, as far as I know. I was the only one.",
,Mary,"Did you feel, do you have any memories about that? Do you feel singled out at all, or-?",
,Perry,"No I, I really, I didn’t. I didn’t have that feeling at all. No, I was, I don’t remember, I don’t have any real strong impressions of what, why I, all that time, it’s strange, but I don’t remember too much of it happening, or any incidents or… But I think I was pretty, I was pretty happy at, you know, it wasn’t a, it was a good experience. And there was no, no bad feelings or any, any, any prejudice that I, you know I didn’t even, well I didn’t even think about those things, you know, when I was growing up. So-.",
,Lisa,"Do you think those kinds of things affected your parents? Do you remember them talking about any, um, experiences of discrimination or prejudice in their work or their lives?",
,Perry,"No, I don’t think, um, I don’t think that, well they didn’t… Well, I was pretty young, you know, I was from, it was around, through six to ten years of age. So, they didn’t discuss those issues with me. But I, I don’t think, as far as I know, it was a very happy time. I remember their relatives in Japan would encourage them to come back to Japa-, go back to Japan, ‘cause they, they felt it was going to be a, they, I guess they felt that war was coming. But my parents decided, well, they didn’t listen to them, you know, so that probably, they probably felt good about staying in, in the United States. So it must have been a good time for them, too. Relatively speaking. I know hims-, I know my dad said it was, it was a lot easier to, it was easier to make a living in Ja-, in the United States. You know, from his, what he, what he knew was the, was a lot harder to make a living in Japan. So, you know, he probably thought that if he went back, it would be very difficult for him, or for all of us.",
,Lisa,Did your parents want you to go to the Japanese language school and-?,
,Perry,Mm-hmm.,
,Lisa,"So do you remember when you started going, and was your sister also there?",
,Perry,"Yes, we both went. I star-, I guess I started around first grade. Yeah, we were, I guess I was, we were living in – my dad would drive me to school af-, after English school. Although it would be, it wasn’t, it was like, it was 19th Street, so it wasn’t that f-, uh, K Street, so it wasn’t too far, maybe six blocks, or so. So, um, yeah, that’s… Yeah, they encouraged me to go.",
,Lisa,"Did you – some of the students attended Mrs. Schneider’s English class before they went into public schools. And then after they started public schools, they went to Japanese language school in the afternoons. Do you remember if you ever attended Mrs. Schneider’s classes?",
0:15:11,Perry,"No, I remember going to, there was a Ms. Rye, or, I’m not sure. She had a Christian school of some kind, over maybe, couple of blocks over, to, towards maybe 12th Street, or something like that. I went, I did go, I remember going there.",
,Lisa,"At, when was that? Was that-?",
,Perry,"Umm, I think it was bef-, I think it was before I started grade school. And I, I remember…the only – yeah, my memory – I don’t…let’s see, I don’t. The only thing I remember is I had a good friend. He was, he went with me, and then we, he started off with me, but…he, he used a word that she didn’t like, and, uh, and scolded him, and then he left. He didn’t, he never came back after that. That’s the only thing I remember about the school.",
,Lisa,"Were your playmates, when you were in grade school, were they mostly other Japanese children, or were they Caucasian children from school?",
,Perry,"I, uh, playmates, I guess, in, yeah, before we moved they were Japanese, and then about, I had some, when I was going to Japanese school I had good, pretty close friends. But I had Caucasian friends around the neighborhood at 19th and K. That’s, I guess on weekends, that’s who I, you know, I didn’t go down to the Japanese areas. I stayed around our, our store and played, played with the friends there.",
,Lisa,"Did, did you help out in the store? Did your father expect you to help out?",
,Perry,"No, my, my sister did. She helped. But I, I don’t think he was very strict, you know, about the hours, or…so… And I never, I didn’t help much, or hardly at all.",
,Lisa,"How about, oh sorry.",
,Perry,"But I did hang out, I remember I used to listen to the radio in the back of the store. But that’s about… And I don’t think I ever waited on anybody.",
,Lisa,You were the little boy.,
,Perry,Yeah.,
,Mary,"And you said that your father would take you, and your sister as well, down to the school?",
,Perry,"No, he used to just take me. I don’t know how my sister got there. I don’t know what, how that worked out.",
,Mary,So she was older.,
,Perry,"Yes, five years older, she is, so...",
,Mary,Would he come pick you up as well?,
,Perry,"I, I don’t think so. I, I think I walked back.",
,Lisa,"Where was your sister in school, then?",
,Perry,"She was going, she was in, she was in junior high and, and then she was in first grade of high school, Lincoln.",
,Lisa,She was at Lincoln. And do you remember which junior high it would have been?,
,Perry,"I think it was McCarver, but I’m not sure.",
,Lisa,Yeah.,
,Mary,But she also went to the language school throughout her-.,
,Perry,"Yes. Yeah, but, I don’t recall seeing her. I don’t re-, have any memory of seeing her at the school. Of all of the time that we… I don’t, actually I don’t recall too much about the school.",
,Mary,"Do, do, oh go ahead.",
,Perry,"I just remember a couple of the teachers that I had, just, you know briefly, what they looked like. And then, and then I remember one of the principal’s daughters, I think, taught at the school. And she, she, I was in, in her class for one year. Four, four, there were, and then four, four of us became pretty good friends. And I remember she, we went on a, I think she took us on an outing to Point Defiance, or there used to be a fort, Fort Defiance? I don’t know.",
0:20:09,Mary,"Fort Steilacoom, maybe. Fort Steilacoom, which was located out at Point Defiance Park.",
,Perry,"Okay. There was a, a log, big log, uh-.",
,Mary,Kind of a stockade?,
,Perry,Stockade.,
,Perry,"I used to have a picture of the four of us that she took, but somehow, I don’t know where it went to, but-.",
,Lisa,Do you remember the other four? Their names? That were your close friends.,
,Perry,"Yeah. One, this was Urishibata-.",
,Lisa,Kunio?,
,Perry,"No, his son, I mean his bro-, younger brother. I forget, To-, Toshir-, Tosh-.",
,Mary,I think that’s.,
,Lisa,Yeah.,
,Perry,"I think he’s in Richmond. And then there was Manabu, and I, well I forget his last name. And there was Henry Hashimoto, from, actually from Sea-, now he’s in Seattle. And there was another fellow, I don’t, now I forget, I forget his name now. Yeah, I forget his name totally. So…",
,Lisa,"And, you, how did you meet them? Was that just through the school?",
,Perry,"I think it was through the school. I mean, you know, we had the same teacher. And I don’t know what happened. The next year, we all got split up. I mean, well maybe I was split off from them somehow. And we had a new, different teacher. And I, and I know – I remember at the beginning of the year I was pretty unhappy. But, you know, I couldn’t verbalize why, and I remember, remember just jumping when we got to school, you know, I just before I got to school, I just jumped out of the car and then walked back home.",
,Lisa,Oh.,
,Perry,"My dad was kind of ups-, you know he wanted to know what was going on, just went on to talk, you know, I don’t know who we talked to, but, but I remember I, you know, just how unhappy I was at the beginning of the next year.",
,Lisa,Was your dad able to figure it out? Did the teachers understand what had happened?,
,Perry,"I, I don’t think so, I don’t-.",
,Lisa,So do you have memories of Mr. and Mrs. Yamasaki? Principal and his wife who was also a teacher?,
,Perry,"I just have a, a picture of what they looked like. He was a – by that, by that time he was, he’s a lot older than he looks in this photo here, and his wife, you know, of course is older too. She was, by that time she was pretty stout, and he, he was a, he was a pretty stern-looking guy. You know he, to me he looked very imposing, you know, pretty tall and pretty scary guy [laughter]. I think he was very strict. But he never, I never saw him… I don’t think I remember him hollering at anybody, yelling at anybody, or anything like that. Or his wife, either. And his daughters are very, very, very nice. As far as I know. No, I had never heard any bad words said about them.",
,Lisa,"Who else did you have as teachers, do you remember them?",
,Perry,"I just, I remember they, the year after I had, the year that I was separated from my friends. And uh, he was, he had, he was pretty short and he had sort of a darker complexion, and he wore glasses, I believe. I think he was very sh-, he must have been very short, because I remember him as being, you know, not much taller than I was. So, but I don’t, I forget his name. I don’t remember his name.",
,Mary,But you said that you felt that the principal was strict and he was kind of scary.,
,Perry,Right.,
,Mary,Did you feel that way about any of the other teachers?,
,Perry,"Mmm, no. I, I don’t, actually, I don’t remember any other teachers.",
0:24:58,Lisa,"You remember a lot, I have to tell you [laughter]. You’ve got a great memory.",
,"What kinds of things did you learn there, what kinds of lessons did you have? Any…",,
,Perry,"I know there was a lot, the language, but that was the main thing I remember, and I don’t remember ethics, or conduct, or anything like that. Although it was probably taught, but it didn’t, maybe it didn’t reach me, I don’t know.",
,Mary,Do you remember any of the activities at school?,
,Perry,"I think there was a athletic day, but I don’t, I don’t, I don’t even remember where it was that, well, we had that. So, I remember they had, they had a, the only thing I remember, they used to have rings that you swing by in the back. And I remember, I remember because I couldn’t, I couldn’t navigate them. That always bothered me, why didn’t I learn how to do that? It was a great opportunity.",
,Lisa,Some of the children played baseball there in the backyard of the school. Did you play baseball ever?,
,Perry,I don’t think so.,
,Lisa,"Well you would have gone there through fifth grade, I think you said.",
,Perry,"Yeah, about fifth grade.",
,Lisa,"So it’s a, yeah (unintelligible mumbling).",
,Mary,Did you remember any activities from the public school?,
,Perry,"No, we did – extracurricular activities?",
,"Lisa, Mary",Mm-hmm.,
,Perry,"No, no. I, I liked to play sports, [sporadic sneezing in the background begins] but I didn’t, they used to play soccer a lot, because they had a big yard, a lot of room at Stanley school, so... But I wasn’t very good at soccer, so… But that’s all I remember of the sports that we played at Stanley.",
,Lisa,You said that at Stanley you think you were probably the only Japanese-American-.,
,Perry,Right.,
,Lisa,In your class at least. So would you go over to your Caucasian friends’ homes and would they come to your home?,
,Perry,"No, we didn’t, I don’t think, they all, I don’t, very rarely did that happen. So, no, I didn’t…I didn’t do that.",
,Lisa,"So when you think about your friends growing up, do you think they were probably mostly in the Japanese community, then? Or are they, were they evenly spread out?",
,Perry,"Well, I, I think I, on the weekends I would hang out with the kids in my neighborhood, who were, who were Caucasian, and I, I didn’t, I didn’t go down towards, towards the center of Tacoma. So-.",
,Lisa,"How about your parents, who would they socialize with?",
,Perry,"We, we used to go from – I remember memories of going to Steilacoom Beach, which is a Japanese beach. I guess that’s the name of the town, Steilacoom – and we, so that when, I guess whenever we took any time off, whenever they took any time off, that’s where we would go, during summer. So yeah, I have, have a, must have gone out there quite a bit, ‘cause I remember quite a lot of the activities that we did have out there. I remember Fourth of July. I remember we used to go out and we’d have, we stayed pretty late and there would be firecrackers, you know, Roman Candles, and we’d there, we’d be there-. I remember, I think we spent – it was somebody out there that had a, a home, maybe, not a home, but he would rent out one or two rooms – it was built out on the water on pilings. I think his name, I remember his name as, I think it was Higuchi. I remember staying there. That was a… I must have enjoyed that a lot.",
,Lisa,Uh-huh.,
0:29:56,Mary,"When you say it was a Japanese beach, did, does that mean that Japanese didn’t go to other beaches, or that just no Caucasians came to that, to Steilacoom Beach, or-?",
,Perry,"Yeah, there, yeah there were no Caucasians, it was a very, it wasn’t a, I don’t think it was a very big beach. But there were no Caucasians, and that’s, I don’t know why – well, and it wasn’t, let’s see… Yeah, I never, we never used to think about race very mu-, I mean, maybe I was too young. But after the war started then, you know, of course it was a lot more on my mind, I was older, so-.",
,Mary,"You didn’t think about it at the time, but when you look back, do you have any kind of reflections about it?",
,Perry,"About my relations with, uh…?",
,Lisa,Mmhmm.,
,Perry,"I think that, I think that growing up I didn’t think anything about it, I just – you know, I always thought of myself as Japanese because I was in, because I had Japa-, there was a Japanese community, and I used to go to church and you know, go to Japanese school, and... But, you know, I felt very comfortable going to a all-Caucasian school, you know, I don’t think it ever bothered me, and even though apparently I didn’t have any, I didn’t make any really close school-mates. But [sirens begin in background] I guess uh, I guess, you know, maybe I was too carefree, not worrying about, thinking about things like that [sirens getting louder and honking].",
,Lisa,Which church did you go to [sirens continue]?,
,Perry,"The, there was a Methodist Church on, I think it was on 19th Street, I’m not sure, down Fawcett Avenue, I believe [sirens continue].",
,Lisa,"What kind of a role did the church play in your life, with your family? Did you go there often?",
,Perry,"Yeah, I used to go to the, mainly to the, they had a [door slamming] Sunday school, and I, my mother would encourage me to go. But I went, I think I always went alone [sirens fading], I’m not sure how I got there even, but she, although she didn’t go herself there [sirens gone].",
,Lisa,Your mother.,
,Perry,"Yeah. Umm, I, I don’t know, she might have not, she was not [sirens resume], her friends did not, she didn’t have friends in the church, [sirens quiet] Her friends were mostly her fath-, her husband’s frien-, my dad’s friends. And she may not have gotten along with the oth-, with some of the others. But she liked to, she liked to read the Bible, and encourage me to go, so-. And I, I remember a lot of the, I remember going, having these Sunday school lessons in different parts of the church. But I’d – oh, and they used to have mov-, I think they used to have movies in the basement. Although this lady said today that “No, you didn’t, there were no [laughter] movies there” [truck backing up].",
,Lisa,"We’ve heard about some movies though, that the youth group would hold them, at the Methodist Church, I believe, in some of the other interviews. And you said that your mom’s friends were mostly your dad’s friends-.",
,Perry,"Yeah, I guess she didn’t have, she didn’t, I don’t remember if she had a, any close friends.",
,Lisa,How-- I’m sorry.,
,Perry,"The one time that, uh, my father criticized my mother is he was complaining that she didn’t like his friends and so he was saying that he didn’t have too many friends because of his, because she didn’t like his friends. But she didn’t have too many friends of, I don’t remember her having any close friends.",
0:35:16,Lisa,"How did your dad meet his friends, were they business associates, or through the language schoo-, other parents, or the church?",
,Perry,"I, I think mainly they were friends that he made when he, before he, before he got married, but I’m not sure.",
,Mary,"At the pool hall, maybe that’s why your mother didn’t like them. [general laughter]",
,Perry,That’s…probably true. [laughter],
,Lisa,"So you said that, that the lessons about the ethics and conduct, you don’t really remember them at the language school. How about from your parents, were those-?",
,Perry,"No, she just told me, you know, go to, go to Sunday school. And, she didn’t try to enforce any rules. My dad was not, was very easygoing, my mother was, although she believed in the Bible and wanted, encouraged me to go to, as much as she could, to, though she never went, she didn’t go herself. So I used to go, that’s about it.",
,Lisa,"Did you think about that as a child, and wonder, “I have to go, why my mom’s not going?”",
,Perry,"No, I, I got, I didn’t. Maybe I should have. [laughter] But...",
,Mary,"What about your relationship with your sister, she was quite a bit older than you.",
,Perry,"Yeah. We, we weren’t very close. And she, I think she, she was not too happy that she was expected to look out for the younger, look out for me. And maybe my mother, you know, tried to have her do that. And she, she might have resented that. But she, she wanted to… She didn’t want a little brother hanging around all the time. I got that impression. I, I didn’t, so I didn’t see much of her growing up.",
,Mary,Do you think your parents had different expectations of her and of you?,
